Active;Name *;Price tax excluded;Tax rules ID;Wholesale price;Reference #;Supplier;Manufacturer;EAN13;Width;Height;Depth;Weight;Tags (xyz...);Meta title;Meta keywords;URL rewritten;ID store
1;Eventuri BMW G20/G42 B58 Intake System - Post 2018 November;1333;78;799.8;EVE-G20B58-V2-INT;Element 1 Engineering - Eventuri;Eventuri;;0;0;0;0;Eventuri,BMW,G20/G42,B58,Intake,System,-,Post,2018,November,EVE-G20B58-V2-INT,Eventuri;Eventuri BMW G20/G42 B58 Intake System - Post 2018 November;Eventuri,BMW,G20/G42,B58,Intake,System,-,Post,2018,November,EVE-G20B58-V2-INT,Eventuri;Eventuri-EVE-G20B58-V2-INT;3
1;Eventuri BMW G20, G29 Z4, B48 Engine Cover;571;78;342.6;EVE-G20B48-CF-ENG;Element 1 Engineering - Eventuri;Eventuri;;0;0;0;0;Eventuri,BMW,G20,,G29,Z4,,B48,Engine,Cover,EVE-G20B48-CF-ENG,Eventuri;Eventuri BMW G20, G29 Z4, B48 Engine Cover;Eventuri,BMW,G20,,G29,Z4,,B48,Engine,Cover,EVE-G20B48-CF-ENG,Eventuri;Eventuri-EVE-G20B48-CF-ENG;3
1;Eventuri BMW G29 Z4 M40i B58 Carbon Intake;1333;78;799.8;EVE-Z4B58-CF-INT;Element 1 Engineering - Eventuri;Eventuri;;0;0;0;0;Eventuri,BMW,G29,Z4,M40i,B58,Carbon,Intake,EVE-Z4B58-CF-INT,Eventuri;Eventuri BMW G29 Z4 M40i B58 Carbon Intake;Eventuri,BMW,G29,Z4,M40i,B58,Carbon,Intake,EVE-Z4B58-CF-INT,Eventuri;Eventuri-EVE-Z4B58-CF-INT;3
1;Eventuri BMW G29 Z4 2.0 B48 Carbon Intake;1333;78;799.8;EVE-G29Z4-B48-INT;Element 1 Engineering - Eventuri;Eventuri;;0;0;0;0;Eventuri,BMW,G29,Z4,2.0,B48,Carbon,Intake,EVE-G29Z4-B48-INT,Eventuri;Eventuri BMW G29 Z4 2.0 B48 Carbon Intake;Eventuri,BMW,G29,Z4,2.0,B48,Carbon,Intake,EVE-G29Z4-B48-INT,Eventuri;Eventuri-EVE-G29Z4-B48-INT;3
1;Eventuri BMW G8X M3/M4/CSL Carbon Engine Cover - Gloss Finish;900;78;540;EVE-G8XM-CF-ENG;Element 1 Engineering - Eventuri;Eventuri;;0;0;0;0;Eventuri,BMW,G8X,M3/M4/CSL,Carbon,Engine,Cover,-,Gloss,Finish,EVE-G8XM-CF-ENG,Eventuri;Eventuri BMW G8X M3/M4/CSL Carbon Engine Cover - Gloss Finish;Eventuri,BMW,G8X,M3/M4/CSL,Carbon,Engine,Cover,-,Gloss,Finish,EVE-G8XM-CF-ENG,Eventuri;Eventuri-EVE-G8XM-CF-ENG;3
1;Eventuri BMW G8X M3/M4/CSL Carbon Engine Cover - Matte Finish;900;78;540;EVE-G8XM-CFM-ENG;Element 1 Engineering - Eventuri;Eventuri;;0;0;0;0;Eventuri,BMW,G8X,M3/M4/CSL,Carbon,Engine,Cover,-,Matte,Finish,EVE-G8XM-CFM-ENG,Eventuri;Eventuri BMW G8X M3/M4/CSL Carbon Engine Cover - Matte Finish;Eventuri,BMW,G8X,M3/M4/CSL,Carbon,Engine,Cover,-,Matte,Finish,EVE-G8XM-CFM-ENG,Eventuri;Eventuri-EVE-G8XM-CFM-ENG;3
1;Eventuri BMW G8X M3/M4 Carbon Intake for all strut braces - Gloss Finish;2650;78;1590;EVE-G8XMV2-CF-INT;Element 1 Engineering - Eventuri;Eventuri;;0;0;0;0;Eventuri,BMW,G8X,M3/M4,Carbon,Intake,for,all,strut,braces,-,Gloss,Finish,EVE-G8XMV2-CF-INT,Eventuri;Eventuri BMW G8X M3/M4 Carbon Intake for all strut braces - Gloss Finish;Eventuri,BMW,G8X,M3/M4,Carbon,Intake,for,all,strut,braces,-,Gloss,Finish,EVE-G8XMV2-CF-INT,Eventuri;Eventuri-EVE-G8XMV2-CF-INT;3
1;Eventuri BMW G8X M3/M4 Carbon Intake for all strut braces - Matte Finish;2650;78;1590;EVE-G8XMV2-CFM-INT;Element 1 Engineering - Eventuri;Eventuri;;0;0;0;0;Eventuri,BMW,G8X,M3/M4,Carbon,Intake,for,all,strut,braces,-,Matte,Finish,EVE-G8XMV2-CFM-INT,Eventuri;Eventuri BMW G8X M3/M4 Carbon Intake for all strut braces - Matte Finish;Eventuri,BMW,G8X,M3/M4,Carbon,Intake,for,all,strut,braces,-,Matte,Finish,EVE-G8XMV2-CFM-INT,Eventuri;Eventuri-EVE-G8XMV2-CFM-INT;3
1;Eventuri Conversion kit for G8X M3/M4 intake for CSL Strut Brace - Gloss;620;78;372;EVE-G8XCSL-CF-KIT;Element 1 Engineering - Eventuri;Eventuri;;0;0;0;0;Eventuri,Conversion,kit,for,G8X,M3/M4,intake,for,CSL,Strut,Brace,-,Gloss,EVE-G8XCSL-CF-KIT,Eventuri;Eventuri Conversion kit for G8X M3/M4 intake for CSL Strut Brace - Gloss;Eventuri,Conversion,kit,for,G8X,M3/M4,intake,for,CSL,Strut,Brace,-,Gloss,EVE-G8XCSL-CF-KIT,Eventuri;Eventuri-EVE-G8XCSL-CF-KIT;3
1;Eventuri Conversion kit for G8X M3/M4 intake for CSL Strut Brace - Matte;620;78;372;EVE-G8XCSL-CFM-KIT;Element 1 Engineering - Eventuri;Eventuri;;0;0;0;0;Eventuri,Conversion,kit,for,G8X,M3/M4,intake,for,CSL,Strut,Brace,-,Matte,EVE-G8XCSL-CFM-KIT,Eventuri;Eventuri Conversion kit for G8X M3/M4 intake for CSL Strut Brace - Matte;Eventuri,Conversion,kit,for,G8X,M3/M4,intake,for,CSL,Strut,Brace,-,Matte,EVE-G8XCSL-CFM-KIT,Eventuri;Eventuri-EVE-G8XCSL-CFM-KIT;3
1;Eventuri BMW N20 120i, 220i, 320i, 328i - Black Carbon Intake;1350;78;810;EVE-N20-CF-INT;Element 1 Engineering - Eventuri;Eventuri;;0;0;0;0;Eventuri,BMW,N20,120i,,220i,,320i,,328i,-,Black,Carbon,Intake,EVE-N20-CF-INT,Eventuri;Eventuri BMW N20 120i, 220i, 320i, 328i - Black Carbon Intake;Eventuri,BMW,N20,120i,,220i,,320i,,328i,-,Black,Carbon,Intake,EVE-N20-CF-INT,Eventuri;Eventuri-EVE-N20-CF-INT;3
1;Eventuri C8 Corvette Stingray Coupe Carbon Intake ;2280;78;1368;EVE-C8VT-CF-INT;Element 1 Engineering - Eventuri;Eventuri;;0;0;0;0;Eventuri,C8,Corvette,Stingray,Coupe,Carbon,Intake,,EVE-C8VT-CF-INT,Eventuri;Eventuri C8 Corvette Stingray Coupe Carbon Intake ;Eventuri,C8,Corvette,Stingray,Coupe,Carbon,Intake,,EVE-C8VT-CF-INT,Eventuri;Eventuri-EVE-C8VT-CF-INT;3
1;Eventuri C8 Corvette Stingray Hard Top Convertible Carbon Intake ;2280;78;1368;EVE-C8HTC-CF-INT;Element 1 Engineering - Eventuri;Eventuri;;0;0;0;0;Eventuri,C8,Corvette,Stingray,Hard,Top,Convertible,Carbon,Intake,,EVE-C8HTC-CF-INT,Eventuri;Eventuri C8 Corvette Stingray Hard Top Convertible Carbon Intake ;Eventuri,C8,Corvette,Stingray,Hard,Top,Convertible,Carbon,Intake,,EVE-C8HTC-CF-INT,Eventuri;Eventuri-EVE-C8HTC-CF-INT;3
1;Eventuri C8 Corvette Stingray Carbon Engine Cover ;550;78;330;EVE-C8VT-CF-ENG;Element 1 Engineering - Eventuri;Eventuri;;0;0;0;0;Eventuri,C8,Corvette,Stingray,Carbon,Engine,Cover,,EVE-C8VT-CF-ENG,Eventuri;Eventuri C8 Corvette Stingray Carbon Engine Cover ;Eventuri,C8,Corvette,Stingray,Carbon,Engine,Cover,,EVE-C8VT-CF-ENG,Eventuri;Eventuri-EVE-C8VT-CF-ENG;3
1;Eventuri C8 Z06 Coupe Carbon Intake;2360;78;1416;EVE-Z06VT-CF-INT;Element 1 Engineering - Eventuri;Eventuri;;0;0;0;0;Eventuri,C8,Z06,Coupe,Carbon,Intake,EVE-Z06VT-CF-INT,Eventuri;Eventuri C8 Z06 Coupe Carbon Intake;Eventuri,C8,Z06,Coupe,Carbon,Intake,EVE-Z06VT-CF-INT,Eventuri;Eventuri-EVE-Z06VT-CF-INT;3
1;Eventuri C8 Z06 Hard Top Convertible Carbon Intake;2360;78;1416;EVE-Z06HTC-CF-INT;Element 1 Engineering - Eventuri;Eventuri;;0;0;0;0;Eventuri,C8,Z06,Hard,Top,Convertible,Carbon,Intake,EVE-Z06HTC-CF-INT,Eventuri;Eventuri C8 Z06 Hard Top Convertible Carbon Intake;Eventuri,C8,Z06,Hard,Top,Convertible,Carbon,Intake,EVE-Z06HTC-CF-INT,Eventuri;Eventuri-EVE-Z06HTC-CF-INT;3
1;Eventuri Honda FK2 Black Carbon MAF-TUBE and silicone hose;238;78;142.8;EVE-FK2-CF-MAF;Element 1 Engineering - Eventuri;Eventuri;;0;0;0;0;Eventuri,Honda,FK2,Black,Carbon,MAF-TUBE,and,silicone,hose,EVE-FK2-CF-MAF,Eventuri;Eventuri Honda FK2 Black Carbon MAF-TUBE and silicone hose;Eventuri,Honda,FK2,Black,Carbon,MAF-TUBE,and,silicone,hose,EVE-FK2-CF-MAF,Eventuri;Eventuri-EVE-FK2-CF-MAF;3
1;Eventuri V2 FK2 Civic Type R LHD Carbon intake with upgraded Carbon Tube;1209;78;725.4;EVE-FK2V2-CF-LHD-INT;Element 1 Engineering - Eventuri;Eventuri;;0;0;0;0;Eventuri,V2,FK2,Civic,Type,R,LHD,Carbon,intake,with,upgraded,Carbon,Tube,EVE-FK2V2-CF-LHD-INT,Eventuri;Eventuri V2 FK2 Civic Type R LHD Carbon intake with upgraded Carbon Tube;Eventuri,V2,FK2,Civic,Type,R,LHD,Carbon,intake,with,upgraded,Carbon,Tube,EVE-FK2V2-CF-LHD-INT,Eventuri;Eventuri-EVE-FK2V2-CF-LHD-INT;3
1;Eventuri V2 FK2 Civic Type R RHD Carbon intake with upgraded Carbon Tube;1209;78;725.4;EVE-FK2V2-CF-RHD-INT;Element 1 Engineering - Eventuri;Eventuri;;0;0;0;0;Eventuri,V2,FK2,Civic,Type,R,RHD,Carbon,intake,with,upgraded,Carbon,Tube,EVE-FK2V2-CF-RHD-INT,Eventuri;Eventuri V2 FK2 Civic Type R RHD Carbon intake with upgraded Carbon Tube;Eventuri,V2,FK2,Civic,Type,R,RHD,Carbon,intake,with,upgraded,Carbon,Tube,EVE-FK2V2-CF-RHD-INT,Eventuri;Eventuri-EVE-FK2V2-CF-RHD-INT;3
1;Eventuri Engine Cover Red and Black;476;78;285.6;EVE-FK8FK2-ENG;Element 1 Engineering - Eventuri;Eventuri;;0;0;0;0;Eventuri,FL5,,FK8,and,FK2,Engine,Cover,Red,and,Black,EVE-FK8FK2-ENG,Eventuri;Eventuri FL5, FK8 and FK2 Engine Cover Red and Black;Eventuri,FL5,,FK8,and,FK2,Engine,Cover,Red,and,Black,EVE-FK8FK2-ENG,Eventuri;Eventuri-EVE-FK8FK2-ENG;3
1;Eventuri FK2 V3 Oversized Carbon Turbo Tube ;665;78;399;EVE-FK2V3-CF-CHG;Element 1 Engineering - Eventuri;Eventuri;;0;0;0;0;Eventuri,FK2,V3,Oversized,Carbon,Turbo,Tube,,EVE-FK2V3-CF-CHG,Eventuri;Eventuri FK2 V3 Oversized Carbon Turbo Tube ;Eventuri,FK2,V3,Oversized,Carbon,Turbo,Tube,,EVE-FK2V3-CF-CHG,Eventuri;Eventuri-EVE-FK2V3-CF-CHG;3
1;Eventuri FK2 V3 Oversized Carbon Turbo Tube - Tube only Upgrade for existing owners;410;78;246;EVE-FK2V3-CHG-UPG;Element 1 Engineering - Eventuri;Eventuri;;0;0;0;0;Eventuri,FK2,V3,Oversized,Carbon,Turbo,Tube,-,Tube,only,Upgrade,for,existing,owners,EVE-FK2V3-CHG-UPG,Eventuri;Eventuri FK2 V3 Oversized Carbon Turbo Tube - Tube only Upgrade for existing owners;Eventuri,FK2,V3,Oversized,Carbon,Turbo,Tube,-,Tube,only,Upgrade,for,existing,owners,EVE-FK2V3-CHG-UPG,Eventuri;Eventuri-EVE-FK2V3-CHG-UPG;3
1;Eventuri FK8 Civic Type R Black Carbon intake;1380;78;828;EVE-FK8-CF-INT;Element 1 Engineering - Eventuri;Eventuri;;0;0;0;0;Eventuri,FK8,Civic,Type,R,Black,Carbon,intake,EVE-FK8-CF-INT,Eventuri;Eventuri FK8 Civic Type R Black Carbon intake;Eventuri,FK8,Civic,Type,R,Black,Carbon,intake,EVE-FK8-CF-INT,Eventuri;Eventuri-EVE-FK8-CF-INT;3
1;Eventuri FK8 Carbon V2 MAF Tube and Silicon Set;328;78;196.8;EVE-FK8V2-CF-MAF;Element 1 Engineering - Eventuri;Eventuri;;0;0;0;0;Eventuri,FK8,Carbon,V2,MAF,Tube,and,Silicon,Set,EVE-FK8V2-CF-MAF,Eventuri;Eventuri FK8 Carbon V2 MAF Tube and Silicon Set;Eventuri,FK8,Carbon,V2,MAF,Tube,and,Silicon,Set,EVE-FK8V2-CF-MAF,Eventuri;Eventuri-EVE-FK8V2-CF-MAF;3
1;Eventuri FK8 V3 Oversized Carbon Turbo Tube ;665;78;399;EVE-FK8V3-CF-CHG;Element 1 Engineering - Eventuri;Eventuri;;0;0;0;0;Eventuri,FK8,V3,Oversized,Carbon,Turbo,Tube,,EVE-FK8V3-CF-CHG,Eventuri;Eventuri FK8 V3 Oversized Carbon Turbo Tube ;Eventuri,FK8,V3,Oversized,Carbon,Turbo,Tube,,EVE-FK8V3-CF-CHG,Eventuri;Eventuri-EVE-FK8V3-CF-CHG;3
1;Eventuri FK8 V3 Oversized Carbon Turbo Tube - Tube only Upgrade for existing owners;410;78;246;EVE-FK8V3-CHG-UPG;Element 1 Engineering - Eventuri;Eventuri;;0;0;0;0;Eventuri,FK8,V3,Oversized,Carbon,Turbo,Tube,-,Tube,only,Upgrade,for,existing,owners,EVE-FK8V3-CHG-UPG,Eventuri;Eventuri FK8 V3 Oversized Carbon Turbo Tube - Tube only Upgrade for existing owners;Eventuri,FK8,V3,Oversized,Carbon,Turbo,Tube,-,Tube,only,Upgrade,for,existing,owners,EVE-FK8V3-CHG-UPG,Eventuri;Eventuri-EVE-FK8V3-CHG-UPG;3
1;Eventuri FL5 Civic Type R / 2024 Integra Type S Carbon Intake;1450;78;870;EVE-FL5-CF-INT;Element 1 Engineering - Eventuri;Eventuri;;0;0;0;0;Eventuri,FL5,Civic,Type,R,/,2024,Integra,Type,S,Carbon,Intake,EVE-FL5-CF-INT,Eventuri;Eventuri FL5 Civic Type R / 2024 Integra Type S Carbon Intake;Eventuri,FL5,Civic,Type,R,/,2024,Integra,Type,S,Carbon,Intake,EVE-FL5-CF-INT,Eventuri;Eventuri-EVE-FL5-CF-INT;3
1;Eventuri FL5 Civic Type R / 2024 Integra Type S Carbon Turbo Tube;665;78;399;EVE-FL5-CF-CHG;Element 1 Engineering - Eventuri;Eventuri;;0;0;0;0;Eventuri,FL5,Civic,Type,R,/,2024,Integra,Type,S,Carbon,Turbo,Tube,EVE-FL5-CF-CHG,Eventuri;Eventuri FL5 Civic Type R / 2024 Integra Type S Carbon Turbo Tube;Eventuri,FL5,Civic,Type,R,/,2024,Integra,Type,S,Carbon,Turbo,Tube,EVE-FL5-CF-CHG,Eventuri;Eventuri-EVE-FL5-CF-CHG;3
1;Eventuri Lamborghini Huracan Carbon Intake;2210;78;1326;EVE-HCN-CF-INT;Element 1 Engineering - Eventuri;Eventuri;;0;0;0;0;Eventuri,Lamborghini,Huracan,Carbon,Intake,EVE-HCN-CF-INT,Eventuri;Eventuri Lamborghini Huracan Carbon Intake;Eventuri,Lamborghini,Huracan,Carbon,Intake,EVE-HCN-CF-INT,Eventuri;Eventuri-EVE-HCN-CF-INT;3
1;Eventuri Lamborghini Huracan Carbon Engine Cover Set Matte Finish;4350;78;2610;EVE-HCN-CFM-ENG;Element 1 Engineering - Eventuri;Eventuri;;0;0;0;0;Eventuri,Lamborghini,Huracan,Carbon,Engine,Cover,Set,Matte,Finish,EVE-HCN-CFM-ENG,Eventuri;Eventuri Lamborghini Huracan Carbon Engine Cover Set Matte Finish;Eventuri,Lamborghini,Huracan,Carbon,Engine,Cover,Set,Matte,Finish,EVE-HCN-CFM-ENG,Eventuri;Eventuri-EVE-HCN-CFM-ENG;3
1;Eventuri Lotus Emira V6 Supercharged Carbon Intake;1285;78;771;EVE-EMV6-CF-INT;Element 1 Engineering - Eventuri;Eventuri;;0;0;0;0;Eventuri,Lotus,Emira,V6,Supercharged,Carbon,Intake,EVE-EMV6-CF-INT,Eventuri;Eventuri Lotus Emira V6 Supercharged Carbon Intake;Eventuri,Lotus,Emira,V6,Supercharged,Carbon,Intake,EVE-EMV6-CF-INT,Eventuri;Eventuri-EVE-EMV6-CF-INT;3
1;Eventuri Mercedes A35 AMG, GLA35, GLB35, A250 Carbon Intake;1238;78;742.8;EVE-A35-CF-INT;Element 1 Engineering - Eventuri;Eventuri;;0;0;0;0;Eventuri,Mercedes,A35,AMG,,GLA35,,GLB35,,A250,Carbon,Intake,EVE-A35-CF-INT,Eventuri;Eventuri Mercedes A35 AMG, GLA35, GLB35, A250 Carbon Intake;Eventuri,Mercedes,A35,AMG,,GLA35,,GLB35,,A250,Carbon,Intake,EVE-A35-CF-INT,Eventuri;Eventuri-EVE-A35-CF-INT;3
1;Eventuri Mercedes A35 AMG, GLA35, GLB35, Turbo Tube;714;78;428.4;EVE-A35-CF-CHG;Element 1 Engineering - Eventuri;Eventuri;;0;0;0;0;Eventuri,Mercedes,A35,AMG,,GLA35,,GLB35,,Turbo,Tube,EVE-A35-CF-CHG,Eventuri;Eventuri Mercedes A35 AMG, GLA35, GLB35, Turbo Tube;Eventuri,Mercedes,A35,AMG,,GLA35,,GLB35,,Turbo,Tube,EVE-A35-CF-CHG,Eventuri;Eventuri-EVE-A35-CF-CHG;3
1;Eventuri Mercedes A45S CLA45S GLA45 GLB45 AMG Carbon Intake ;1333;78;799.8;EVE-A45S-CF-INT;Element 1 Engineering - Eventuri;Eventuri;;0;0;0;0;Eventuri,Mercedes,A45S,CLA45S,GLA45,GLB45,AMG,Carbon,Intake,,EVE-A45S-CF-INT,Eventuri;Eventuri Mercedes A45S CLA45S GLA45 GLB45 AMG Carbon Intake ;Eventuri,Mercedes,A45S,CLA45S,GLA45,GLB45,AMG,Carbon,Intake,,EVE-A45S-CF-INT,Eventuri;Eventuri-EVE-A45S-CF-INT;3
1;Eventuri Mercedes C190/R190 AMG GTR, GTS, GT GLOSS Finish;2380;78;1428;EVE-AMGGT-CF-INT;Element 1 Engineering - Eventuri;Eventuri;;0;0;0;0;Eventuri,Mercedes,C190/R190,AMG,GTR,,GTS,,GT,GLOSS,Finish,EVE-AMGGT-CF-INT,Eventuri;Eventuri Mercedes C190/R190 AMG GTR, GTS, GT GLOSS Finish;Eventuri,Mercedes,C190/R190,AMG,GTR,,GTS,,GT,GLOSS,Finish,EVE-AMGGT-CF-INT,Eventuri;Eventuri-EVE-AMGGT-CF-INT;3
1;Eventuri Mercedes C190/R190 AMG GTR, GTS, GT MATTE Finish;2380;78;1428;EVE-AMGGT-CFM-INT;Element 1 Engineering - Eventuri;Eventuri;;0;0;0;0;Eventuri,Mercedes,C190/R190,AMG,GTR,,GTS,,GT,MATTE,Finish,EVE-AMGGT-CFM-INT,Eventuri;Eventuri Mercedes C190/R190 AMG GTR, GTS, GT MATTE Finish;Eventuri,Mercedes,C190/R190,AMG,GTR,,GTS,,GT,MATTE,Finish,EVE-AMGGT-CFM-INT,Eventuri;Eventuri-EVE-AMGGT-CFM-INT;3
1;Eventuri Mercedes all X205 C63/C63S variants, AMG Carbon intake;2714;78;1628.4;EVE-C63S-CF-INT;Element 1 Engineering - Eventuri;Eventuri;;0;0;0;0;Eventuri,Mercedes,all,X205,C63/C63S,variants,,AMG,Carbon,intake,EVE-C63S-CF-INT,Eventuri;Eventuri Mercedes all X205 C63/C63S variants, AMG Carbon intake;Eventuri,Mercedes,all,X205,C63/C63S,variants,,AMG,Carbon,intake,EVE-C63S-CF-INT,Eventuri;Eventuri-EVE-C63S-CF-INT;3
1;Eventuri C63S Carbon Duct upgrade package;162;78;97.2;EVE-C63S-DCT;Element 1 Engineering - Eventuri;Eventuri;;0;0;0;0;Eventuri,C63S,Carbon,Duct,upgrade,package,EVE-C63S-DCT,Eventuri;Eventuri C63S Carbon Duct upgrade package;Eventuri,C63S,Carbon,Duct,upgrade,package,EVE-C63S-DCT,Eventuri;Eventuri-EVE-C63S-DCT;3
1;Eventuri Mercedes GLC63S carbon intake ;2714;78;1628.4;EVE-GLC63S-CF-INT;Element 1 Engineering - Eventuri;Eventuri;;0;0;0;0;Eventuri,Mercedes,GLC63S,carbon,intake,,EVE-GLC63S-CF-INT,Eventuri;Eventuri Mercedes GLC63S carbon intake ;Eventuri,Mercedes,GLC63S,carbon,intake,,EVE-GLC63S-CF-INT,Eventuri;Eventuri-EVE-GLC63S-CF-INT;3
1;Eventuri Mini JCW GP3 / Clubman / JCW 306HP Carbon Intake;1542;78;925.2;EVE-JCWGP3-INT;Element 1 Engineering - Eventuri;Eventuri;;0;0;0;0;Eventuri,Mini,JCW,GP3,/,Clubman,/,JCW,306HP,Carbon,Intake,EVE-JCWGP3-INT,Eventuri;Eventuri Mini JCW GP3 / Clubman / JCW 306HP Carbon Intake;Eventuri,Mini,JCW,GP3,/,Clubman,/,JCW,306HP,Carbon,Intake,EVE-JCWGP3-INT,Eventuri;Eventuri-EVE-JCWGP3-INT;3
1;Eventuri Mini JCW Countryman 306HP Carbon Intake with no scoop;1305;78;783;EVE-F60-306-INT;Element 1 Engineering - Eventuri;Eventuri;;0;0;0;0;Eventuri,Mini,JCW,Countryman,306HP,Carbon,Intake,with,no,scoop,EVE-F60-306-INT,Eventuri;Eventuri Mini JCW Countryman 306HP Carbon Intake with no scoop;Eventuri,Mini,JCW,Countryman,306HP,Carbon,Intake,with,no,scoop,EVE-F60-306-INT,Eventuri;Eventuri-EVE-F60-306-INT;3
1;Eventuri Mini Cooper S / JCW Black Carbon intake;1542;78;925.2;EVE-F56-CF-INT;Element 1 Engineering - Eventuri;Eventuri;;0;0;0;0;Eventuri,Mini,Cooper,S,/,JCW,Black,Carbon,intake,EVE-F56-CF-INT,Eventuri;Eventuri Mini Cooper S / JCW Black Carbon intake;Eventuri,Mini,Cooper,S,/,JCW,Black,Carbon,intake,EVE-F56-CF-INT,Eventuri;Eventuri-EVE-F56-CF-INT;3
1;Eventuri Mini Cooper S / JCW Facelift Black Carbon intake;1542;78;925.2;EVE-F56-LCI-CF-INT;Element 1 Engineering - Eventuri;Eventuri;;0;0;0;0;Eventuri,Mini,Cooper,S,/,JCW,Facelift,Black,Carbon,intake,EVE-F56-LCI-CF-INT,Eventuri;Eventuri Mini Cooper S / JCW Facelift Black Carbon intake;Eventuri,Mini,Cooper,S,/,JCW,Facelift,Black,Carbon,intake,EVE-F56-LCI-CF-INT,Eventuri;Eventuri-EVE-F56-LCI-CF-INT;3
1;Eventuri Mini Cooper S / JCW Plastic intake with Carbon Scoop;952;78;571.2;EVE-F56-PL-INT;Element 1 Engineering - Eventuri;Eventuri;;0;0;0;0;Eventuri,Mini,Cooper,S,/,JCW,Plastic,intake,with,Carbon,Scoop,EVE-F56-PL-INT,Eventuri;Eventuri Mini Cooper S / JCW Plastic intake with Carbon Scoop;Eventuri,Mini,Cooper,S,/,JCW,Plastic,intake,with,Carbon,Scoop,EVE-F56-PL-INT,Eventuri;Eventuri-EVE-F56-PL-INT;3
1;Eventuri Mini Cooper S / JCW Facelift Plastic intake with Carbon Scoop;952;78;571.2;EVE-F56-LCI-PL-INT;Element 1 Engineering - Eventuri;Eventuri;;0;0;0;0;Eventuri,Mini,Cooper,S,/,JCW,Facelift,Plastic,intake,with,Carbon,Scoop,EVE-F56-LCI-PL-INT,Eventuri;Eventuri Mini Cooper S / JCW Facelift Plastic intake with Carbon Scoop;Eventuri,Mini,Cooper,S,/,JCW,Facelift,Plastic,intake,with,Carbon,Scoop,EVE-F56-LCI-PL-INT,Eventuri;Eventuri-EVE-F56-LCI-PL-INT;3
1;Eventuri MINI Countryman S Black Carbon intake with no scoop;1304;78;782.4;EVE-F60-CF-INT;Element 1 Engineering - Eventuri;Eventuri;;0;0;0;0;Eventuri,MINI,Countryman,S,Black,Carbon,intake,with,no,scoop,EVE-F60-CF-INT,Eventuri;Eventuri MINI Countryman S Black Carbon intake with no scoop;Eventuri,MINI,Countryman,S,Black,Carbon,intake,with,no,scoop,EVE-F60-CF-INT,Eventuri;Eventuri-EVE-F60-CF-INT;3
1;Eventuri MINI Countryman S Facelift Black Carbon intake with no scoop;1304;78;782.4;EVE-F60-LCI-CF-INT;Element 1 Engineering - Eventuri;Eventuri;;0;0;0;0;Eventuri,MINI,Countryman,S,Facelift,Black,Carbon,intake,with,no,scoop,EVE-F60-LCI-CF-INT,Eventuri;Eventuri MINI Countryman S Facelift Black Carbon intake with no scoop;Eventuri,MINI,Countryman,S,Facelift,Black,Carbon,intake,with,no,scoop,EVE-F60-LCI-CF-INT,Eventuri;Eventuri-EVE-F60-LCI-CF-INT;3
1;Eventuri MINI Countryman S Plastic intake with no scoop;665;78;399;EVE-F60-PL-INT;Element 1 Engineering - Eventuri;Eventuri;;0;0;0;0;Eventuri,MINI,Countryman,S,Plastic,intake,with,no,scoop,EVE-F60-PL-INT,Eventuri;Eventuri MINI Countryman S Plastic intake with no scoop;Eventuri,MINI,Countryman,S,Plastic,intake,with,no,scoop,EVE-F60-PL-INT,Eventuri;Eventuri-EVE-F60-PL-INT;3
1;Eventuri MINI Countryman S Facelift Plastic intake with no scoop;665;78;399;EVE-F60-LCI-PL-INT;Element 1 Engineering - Eventuri;Eventuri;;0;0;0;0;Eventuri,MINI,Countryman,S,Facelift,Plastic,intake,with,no,scoop,EVE-F60-LCI-PL-INT,Eventuri;Eventuri MINI Countryman S Facelift Plastic intake with no scoop;Eventuri,MINI,Countryman,S,Facelift,Plastic,intake,with,no,scoop,EVE-F60-LCI-PL-INT,Eventuri;Eventuri-EVE-F60-LCI-PL-INT;3
1;Eventuri Porsche 991 Turbo Black Carbon intake;2238;78;1342.8;EVE-P991T-INT;Element 1 Engineering - Eventuri;Eventuri;;0;0;0;0;Eventuri,Porsche,991,Turbo,Black,Carbon,intake,EVE-P991T-INT,Eventuri;Eventuri Porsche 991 Turbo Black Carbon intake;Eventuri,Porsche,991,Turbo,Black,Carbon,intake,EVE-P991T-INT,Eventuri;Eventuri-EVE-P991T-INT;3
1;Eventuri Porsche 991.1 991.2 GT3RS Carbon Intake;2238;78;1342.8;EVE-GT3RS-INT;Element 1 Engineering - Eventuri;Eventuri;;0;0;0;0;Eventuri,Porsche,991.1,991.2,GT3RS,Carbon,Intake,EVE-GT3RS-INT,Eventuri;Eventuri Porsche 991.1 991.2 GT3RS Carbon Intake;Eventuri,Porsche,991.1,991.2,GT3RS,Carbon,Intake,EVE-GT3RS-INT,Eventuri;Eventuri-EVE-GT3RS-INT;3
1;Eventuri Full Black Carbon intake;885;78;531;EVE-2TFSI-CF-INT;Element 1 Engineering - Eventuri;Eventuri;;0;0;0;0;Eventuri,Leon,Cupra,2.0,TFSI-,Full,Black,Carbon,intake,EVE-2TFSI-CF-INT,Eventuri;Eventuri Leon Cupra 2.0 TFSI- Full Black Carbon intake;Eventuri,Leon,Cupra,2.0,TFSI-,Full,Black,Carbon,intake,EVE-2TFSI-CF-INT,Eventuri;Eventuri-EVE-2TFSI-CF-INT;3
1;Eventuri MK4 Leon Cupra Formentor 2.0 VZ1 245hp 2020+ Carbon intake;1333;78;799.8;EVE-EA8884-GTi-INT;Element 1 Engineering - Eventuri;Eventuri;;0;0;0;0;Eventuri,MK4,Leon,Cupra,Formentor,2.0,VZ1,245hp,2020+,Carbon,intake,EVE-EA8884-GTi-INT,Eventuri;Eventuri MK4 Leon Cupra Formentor 2.0 VZ1 245hp 2020+ Carbon intake;Eventuri,MK4,Leon,Cupra,Formentor,2.0,VZ1,245hp,2020+,Carbon,intake,EVE-EA8884-GTi-INT,Eventuri;Eventuri-EVE-EA8884-GTi-INT;3
1;Eventuri  Carbon intake;1333;78;799.8;EVE-EA8884-R-INT;Element 1 Engineering - Eventuri;Eventuri;;0;0;0;0;Eventuri,MK4,Leon,Cupra,Formentor,2.0,VZ2,300hp,2020+,Carbon,intake,EVE-EA8884-R-INT,Eventuri;Eventuri MK4 Leon Cupra Formentor 2.0 VZ2 300hp 2020+ Carbon intake;Eventuri,MK4,Leon,Cupra,Formentor,2.0,VZ2,300hp,2020+,Carbon,intake,EVE-EA8884-R-INT,Eventuri;Eventuri-EVE-EA8884-R-INT;3
1;Eventuri Toyota MK5 3.0 B58 Supra Carbon Intake;1333;78;799.8;EVE-A90-CF-INT;Element 1 Engineering - Eventuri;Eventuri;;0;0;0;0;Eventuri,Toyota,MK5,3.0,B58,Supra,Carbon,Intake,EVE-A90-CF-INT,Eventuri;Eventuri Toyota MK5 3.0 B58 Supra Carbon Intake;Eventuri,Toyota,MK5,3.0,B58,Supra,Carbon,Intake,EVE-A90-CF-INT,Eventuri;Eventuri-EVE-A90-CF-INT;3
1;Eventuri Toyota MK5 2.0 B48 Supra Carbon Intake;1333;78;799.8;EVE-A90B48-INT;Element 1 Engineering - Eventuri;Eventuri;;0;0;0;0;Eventuri,Toyota,MK5,2.0,B48,Supra,Carbon,Intake,EVE-A90B48-INT,Eventuri;Eventuri Toyota MK5 2.0 B48 Supra Carbon Intake;Eventuri,Toyota,MK5,2.0,B48,Supra,Carbon,Intake,EVE-A90B48-INT,Eventuri;Eventuri-EVE-A90B48-INT;3
1;Eventuri Toyota MK5 Supra Carbon Headlamp Duct;790;78;474;EVE-A90-CF-HDP;Element 1 Engineering - Eventuri;Eventuri;;0;0;0;0;Eventuri,Toyota,MK5,Supra,Carbon,Headlamp,Duct,EVE-A90-CF-HDP,Eventuri;Eventuri Toyota MK5 Supra Carbon Headlamp Duct;Eventuri,Toyota,MK5,Supra,Carbon,Headlamp,Duct,EVE-A90-CF-HDP,Eventuri;Eventuri-EVE-A90-CF-HDP;3
1;Eventuri Toyota MK5 Supra Carbon Engine cover;570;78;342;EVE-A90-CF-ENG;Element 1 Engineering - Eventuri;Eventuri;;0;0;0;0;Eventuri,Toyota,MK5,Supra,Carbon,Engine,cover,EVE-A90-CF-ENG,Eventuri;Eventuri Toyota MK5 Supra Carbon Engine cover;Eventuri,Toyota,MK5,Supra,Carbon,Engine,cover,EVE-A90-CF-ENG,Eventuri;Eventuri-EVE-A90-CF-ENG;3
1;Eventuri Toyota GR Yaris/Corolla Carbon Engine Cover - Gloss;570;78;342;EVE-GR4-CF-ENG;Element 1 Engineering - Eventuri;Eventuri;;0;0;0;0;Eventuri,Toyota,GR,Yaris/Corolla,Carbon,Engine,Cover,-,Gloss,EVE-GR4-CF-ENG,Eventuri;Eventuri Toyota GR Yaris/Corolla Carbon Engine Cover - Gloss;Eventuri,Toyota,GR,Yaris/Corolla,Carbon,Engine,Cover,-,Gloss,EVE-GR4-CF-ENG,Eventuri;Eventuri-EVE-GR4-CF-ENG;3
1;Eventuri Toyota GR Yaris/Corolla Carbon Engine Cover - Matte;570;78;342;EVE-GR4-CFM-ENG;Element 1 Engineering - Eventuri;Eventuri;;0;0;0;0;Eventuri,Toyota,GR,Yaris/Corolla,Carbon,Engine,Cover,-,Matte,EVE-GR4-CFM-ENG,Eventuri;Eventuri Toyota GR Yaris/Corolla Carbon Engine Cover - Matte;Eventuri,Toyota,GR,Yaris/Corolla,Carbon,Engine,Cover,-,Matte,EVE-GR4-CFM-ENG,Eventuri;Eventuri-EVE-GR4-CFM-ENG;3
1;Eventuri Toyota GR Yaris Carbon Intake - Gloss;1300;78;780;EVE-GR4-CF-INT;Element 1 Engineering - Eventuri;Eventuri;;0;0;0;0;Eventuri,Toyota,GR,Yaris,Carbon,Intake,-,Gloss,EVE-GR4-CF-INT,Eventuri;Eventuri Toyota GR Yaris Carbon Intake - Gloss;Eventuri,Toyota,GR,Yaris,Carbon,Intake,-,Gloss,EVE-GR4-CF-INT,Eventuri;Eventuri-EVE-GR4-CF-INT;3
1;Eventuri Toyota GR Yaris Carbon Intake - Matte;1300;78;780;EVE-GR4-CFM-INT;Element 1 Engineering - Eventuri;Eventuri;;0;0;0;0;Eventuri,Toyota,GR,Yaris,Carbon,Intake,-,Matte,EVE-GR4-CFM-INT,Eventuri;Eventuri Toyota GR Yaris Carbon Intake - Matte;Eventuri,Toyota,GR,Yaris,Carbon,Intake,-,Matte,EVE-GR4-CFM-INT,Eventuri;Eventuri-EVE-GR4-CFM-INT;3
1;Eventuri Toyota GR Corolla Carbon Intake - Gloss;1440;78;864;EVE-GR4CR-CF-INT;Element 1 Engineering - Eventuri;Eventuri;;0;0;0;0;Eventuri,Toyota,GR,Corolla,Carbon,Intake,-,Gloss,EVE-GR4CR-CF-INT,Eventuri;Eventuri Toyota GR Corolla Carbon Intake - Gloss;Eventuri,Toyota,GR,Corolla,Carbon,Intake,-,Gloss,EVE-GR4CR-CF-INT,Eventuri;Eventuri-EVE-GR4CR-CF-INT;3
1;Eventuri Toyota GR Corolla Carbon Intake - Matte;1440;78;864;EVE-GR4CR-CFM-INT;Element 1 Engineering - Eventuri;Eventuri;;0;0;0;0;Eventuri,Toyota,GR,Corolla,Carbon,Intake,-,Matte,EVE-GR4CR-CFM-INT,Eventuri;Eventuri Toyota GR Corolla Carbon Intake - Matte;Eventuri,Toyota,GR,Corolla,Carbon,Intake,-,Matte,EVE-GR4CR-CFM-INT,Eventuri;Eventuri-EVE-GR4CR-CFM-INT;3
1;Eventuri Toyota GR86 Carbon Intake - Gloss;1300;78;780;EVE-GR86-CF-INT;Element 1 Engineering - Eventuri;Eventuri;;0;0;0;0;Eventuri,Toyota,GR86,Carbon,Intake,-,Gloss,EVE-GR86-CF-INT,Eventuri;Eventuri Toyota GR86 Carbon Intake - Gloss;Eventuri,Toyota,GR86,Carbon,Intake,-,Gloss,EVE-GR86-CF-INT,Eventuri;Eventuri-EVE-GR86-CF-INT;3
1;Eventuri Toyota GR86 Carbon Engine Cover - Gloss;330;78;198;EVE-GR86-CF-ENG;Element 1 Engineering - Eventuri;Eventuri;;0;0;0;0;Eventuri,Toyota,GR86,Carbon,Engine,Cover,-,Gloss,EVE-GR86-CF-ENG,Eventuri;Eventuri Toyota GR86 Carbon Engine Cover - Gloss;Eventuri,Toyota,GR86,Carbon,Engine,Cover,-,Gloss,EVE-GR86-CF-ENG,Eventuri;Eventuri-EVE-GR86-CF-ENG;3
