Active;Name *;Price tax excluded;Tax rules ID;Wholesale price;Reference #;Supplier;Manufacturer;EAN13;Width;Height;Depth;Weight;Tags (xyz...);Meta title;Meta keywords;URL rewritten;ID store
1;Eventuri Audi S1 2.0 TFSI Black Carbon intake;609;78;365.4;EVE-S1-CF-INT;Element 1 Engineering - Eventuri;Eventuri;;0;0;0;0;Eventuri,Audi,S1,2.0,TFSI,Black,Carbon,intake,EVE-S1-CF-INT,Eventuri;Eventuri Audi S1 2.0 TFSI Black Carbon intake;Eventuri,Audi,S1,2.0,TFSI,Black,Carbon,intake,EVE-S1-CF-INT,Eventuri;Eventuri-EVE-S1-CF-INT;3
1;Eventuri Audi S3 8Y 2020+, TTS 2022+ Carbon Intake;1333;78;799.8;EVE-8YS3-CF-INT;Element 1 Engineering - Eventuri;Eventuri;;0;0;0;0;Eventuri,Audi,S3,8Y,2020+,,TTS,2022+,Carbon,Intake,EVE-8YS3-CF-INT,Eventuri;Eventuri Audi S3 8Y 2020+, TTS 2022+ Carbon Intake;Eventuri,Audi,S3,8Y,2020+,,TTS,2022+,Carbon,Intake,EVE-8YS3-CF-INT,Eventuri;Eventuri-EVE-8YS3-CF-INT;3
1;Eventuri Audi 8V RS3 LHD Full Black Carbon intake Gen 1;1647;78;988.2;EVE-8VRS3-CF-LHD-INT;Element 1 Engineering - Eventuri;Eventuri;;0;0;0;0;Eventuri,Audi,8V,RS3,LHD,Full,Black,Carbon,intake,Gen,1,EVE-8VRS3-CF-LHD-INT,Eventuri;Eventuri Audi 8V RS3 LHD Full Black Carbon intake Gen 1;Eventuri,Audi,8V,RS3,LHD,Full,Black,Carbon,intake,Gen,1,EVE-8VRS3-CF-LHD-INT,Eventuri;Eventuri-EVE-8VRS3-CF-LHD-INT;3
1;Eventuri Audi 8V RS3 RHD Full Black Carbon intake Gen 1;1647;78;988.2;EVE-8VRS3-CF-RHD-INT;Element 1 Engineering - Eventuri;Eventuri;;0;0;0;0;Eventuri,Audi,8V,RS3,RHD,Full,Black,Carbon,intake,Gen,1,EVE-8VRS3-CF-RHD-INT,Eventuri;Eventuri Audi 8V RS3 RHD Full Black Carbon intake Gen 1;Eventuri,Audi,8V,RS3,RHD,Full,Black,Carbon,intake,Gen,1,EVE-8VRS3-CF-RHD-INT,Eventuri;Eventuri-EVE-8VRS3-CF-RHD-INT;3
1;Eventuri Audi RS3 Gen 2 / TTRS 8S intake for DAZA and DWNA Engines;1714;78;1028.4;EVE-ST38V8S-CF-INT;Element 1 Engineering - Eventuri;Eventuri;;0;0;0;0;Eventuri,Audi,RS3,Gen,2,/,TTRS,8S,intake,for,DAZA,and,DWNA,Engines,EVE-ST38V8S-CF-INT,Eventuri;Eventuri Audi RS3 Gen 2 / TTRS 8S intake for DAZA and DWNA Engines;Eventuri,Audi,RS3,Gen,2,/,TTRS,8S,intake,for,DAZA,and,DWNA,Engines,EVE-ST38V8S-CF-INT,Eventuri;Eventuri-EVE-ST38V8S-CF-INT;3
1;Eventuri Audi RS3 Gen 2 Duct for APR Throttle Body;400;78;240;EVE-RSQ3-DCT;Element 1 Engineering - Eventuri;Eventuri;;0;0;0;0;Eventuri,Audi,RS3,Gen,2,Duct,for,APR,Throttle,Body,EVE-RSQ3-DCT,Eventuri;Eventuri Audi RS3 Gen 2 Duct for APR Throttle Body;Eventuri,Audi,RS3,Gen,2,Duct,for,APR,Throttle,Body,EVE-RSQ3-DCT,Eventuri;Eventuri-EVE-RSQ3-DCT;3
1;Eventuri Audi RS3 Carbon Headlamp Race Ducts for Stage 3 intake;781;78;468.6;EVE-ST38V8S-CF-HDP;Element 1 Engineering - Eventuri;Eventuri;;0;0;0;0;Eventuri,Audi,RS3,Carbon,Headlamp,Race,Ducts,for,Stage,3,intake,EVE-ST38V8S-CF-HDP,Eventuri;Eventuri Audi RS3 Carbon Headlamp Race Ducts for Stage 3 intake;Eventuri,Audi,RS3,Carbon,Headlamp,Race,Ducts,for,Stage,3,intake,EVE-ST38V8S-CF-HDP,Eventuri;Eventuri-EVE-ST38V8S-CF-HDP;3
1;Eventuri Carbon Intake;1714;78;1028.4;EVE-ST38Y-CF-INT;Element 1 Engineering - Eventuri;Eventuri;;0;0;0;0;Eventuri,Audi,RS3,8Y,2020+,Carbon,Intake,EVE-ST38Y-CF-INT,Eventuri;Eventuri Audi RS3 8Y 2020+ Carbon Intake;Eventuri,Audi,RS3,8Y,2020+,Carbon,Intake,EVE-ST38Y-CF-INT,Eventuri;Eventuri-EVE-ST38Y-CF-INT;3
1;Eventuri Audi RS3 / TTRS Gen 2 8V 8Y LHD Carbon turbo inlet with NO FLANGE;571;78;342.6;EVE-TRB8V8S-LHD-NIL ;Element 1 Engineering - Eventuri;Eventuri;;0;0;0;0;Eventuri,Audi,RS3,/,TTRS,Gen,2,8V,8Y,LHD,Carbon,turbo,inlet,with,NO,FLANGE,EVE-TRB8V8S-LHD-NIL,,Eventuri;Eventuri Audi RS3 / TTRS Gen 2 8V 8Y LHD Carbon turbo inlet with NO FLANGE;Eventuri,Audi,RS3,/,TTRS,Gen,2,8V,8Y,LHD,Carbon,turbo,inlet,with,NO,FLANGE,EVE-TRB8V8S-LHD-NIL,,Eventuri;Eventuri-EVE-TRB8V8S-LHD-NIL ;3
1;Eventuri Audi RS3 / TTRS Gen 2 8V 8Y RHD Carbon turbo inlet with NO FLANGE;571;78;342.6;EVE-TRB8V8S-RHD-NIL ;Element 1 Engineering - Eventuri;Eventuri;;0;0;0;0;Eventuri,Audi,RS3,/,TTRS,Gen,2,8V,8Y,RHD,Carbon,turbo,inlet,with,NO,FLANGE,EVE-TRB8V8S-RHD-NIL,,Eventuri;Eventuri Audi RS3 / TTRS Gen 2 8V 8Y RHD Carbon turbo inlet with NO FLANGE;Eventuri,Audi,RS3,/,TTRS,Gen,2,8V,8Y,RHD,Carbon,turbo,inlet,with,NO,FLANGE,EVE-TRB8V8S-RHD-NIL,,Eventuri;Eventuri-EVE-TRB8V8S-RHD-NIL ;3
1;Eventuri Stock Turbo Flange for RS3/TTRS Carbon Turbo Inlet;47;78;28.2;EVE-TRB8V8S-FLG-STK;Element 1 Engineering - Eventuri;Eventuri;;0;0;0;0;Eventuri,Stock,Turbo,Flange,for,RS3/TTRS,Carbon,Turbo,Inlet,EVE-TRB8V8S-FLG-STK,Eventuri;Eventuri Stock Turbo Flange for RS3/TTRS Carbon Turbo Inlet;Eventuri,Stock,Turbo,Flange,for,RS3/TTRS,Carbon,Turbo,Inlet,EVE-TRB8V8S-FLG-STK,Eventuri;Eventuri-EVE-TRB8V8S-FLG-STK;3
1;Eventuri TTE700/625 Turbo Flange for RS3/TTRS Carbon Turbo Inlet;47;78;28.2;EVE-TRB8V8S-FLG-TTE;Element 1 Engineering - Eventuri;Eventuri;;0;0;0;0;Eventuri,TTE700/625,Turbo,Flange,for,RS3/TTRS,Carbon,Turbo,Inlet,EVE-TRB8V8S-FLG-TTE,Eventuri;Eventuri TTE700/625 Turbo Flange for RS3/TTRS Carbon Turbo Inlet;Eventuri,TTE700/625,Turbo,Flange,for,RS3/TTRS,Carbon,Turbo,Inlet,EVE-TRB8V8S-FLG-TTE,Eventuri;Eventuri-EVE-TRB8V8S-FLG-TTE;3
1;Eventuri SRM GTX, TTE855 Turbo Flange for RS3/TTRS Carbon Turbo Inlet;47;78;28.2;EVE-TRB8V8S-FLG-SRM;Element 1 Engineering - Eventuri;Eventuri;;0;0;0;0;Eventuri,SRM,GTX,,TTE855,Turbo,Flange,for,RS3/TTRS,Carbon,Turbo,Inlet,EVE-TRB8V8S-FLG-SRM,Eventuri;Eventuri SRM GTX, TTE855 Turbo Flange for RS3/TTRS Carbon Turbo Inlet;Eventuri,SRM,GTX,,TTE855,Turbo,Flange,for,RS3/TTRS,Carbon,Turbo,Inlet,EVE-TRB8V8S-FLG-SRM,Eventuri;Eventuri-EVE-TRB8V8S-FLG-SRM;3
1;Eventuri Audi RS3 Gen 2 / TTRS 8S Black and Red Engine Cover;571;78;342.6;EVE-ST38V8S-CF-ENG;Element 1 Engineering - Eventuri;Eventuri;;0;0;0;0;Eventuri,Audi,RS3,Gen,2,/,TTRS,8S,Black,and,Red,Engine,Cover,EVE-ST38V8S-CF-ENG,Eventuri;Eventuri Audi RS3 Gen 2 / TTRS 8S Black and Red Engine Cover;Eventuri,Audi,RS3,Gen,2,/,TTRS,8S,Black,and,Red,Engine,Cover,EVE-ST38V8S-CF-ENG,Eventuri;Eventuri-EVE-ST38V8S-CF-ENG;3
1;Eventuri Audi RSQ3 F3 2019+ Carbon Intake;1714;78;1028.4;EVE-RSQ3-CF-INT;Element 1 Engineering - Eventuri;Eventuri;;0;0;0;0;Eventuri,Audi,RSQ3,F3,2019+,Carbon,Intake,EVE-RSQ3-CF-INT,Eventuri;Eventuri Audi RSQ3 F3 2019+ Carbon Intake;Eventuri,Audi,RSQ3,F3,2019+,Carbon,Intake,EVE-RSQ3-CF-INT,Eventuri;Eventuri-EVE-RSQ3-CF-INT;3
1;Eventuri Audi RSQ3 DWNA Adapter set;71;78;42.6;EVE-RSQ3-DWNA;Element 1 Engineering - Eventuri;Eventuri;;0;0;0;0;Eventuri,Audi,RSQ3,DWNA,Adapter,set,EVE-RSQ3-DWNA,Eventuri;Eventuri Audi RSQ3 DWNA Adapter set;Eventuri,Audi,RSQ3,DWNA,Adapter,set,EVE-RSQ3-DWNA,Eventuri;Eventuri-EVE-RSQ3-DWNA;3
1;Eventuri Audi B8 RS5/RS4 Black Carbon intake;2425;78;1455;EVE-RS5-INT;Element 1 Engineering - Eventuri;Eventuri;;0;0;0;0;Eventuri,Audi,B8,RS5/RS4,Black,Carbon,intake,EVE-RS5-INT,Eventuri;Eventuri Audi B8 RS5/RS4 Black Carbon intake;Eventuri,Audi,B8,RS5/RS4,Black,Carbon,intake,EVE-RS5-INT,Eventuri;Eventuri-EVE-RS5-INT;3
1;Eventuri Audi B8 RS4 Black Carbon Slam Panel Cover;809;78;485.4;EVE-RS4-CF-SLM;Element 1 Engineering - Eventuri;Eventuri;;0;0;0;0;Eventuri,Audi,B8,RS4,Black,Carbon,Slam,Panel,Cover,EVE-RS4-CF-SLM,Eventuri;Eventuri Audi B8 RS4 Black Carbon Slam Panel Cover;Eventuri,Audi,B8,RS4,Black,Carbon,Slam,Panel,Cover,EVE-RS4-CF-SLM,Eventuri;Eventuri-EVE-RS4-CF-SLM;3
1;Eventuri Audi B8 RS5 Black Carbon Facelift Slam Panel Cover;809;78;485.4;EVE-RS5-CF-SLM;Element 1 Engineering - Eventuri;Eventuri;;0;0;0;0;Eventuri,Audi,B8,RS5,Black,Carbon,Facelift,Slam,Panel,Cover,EVE-RS5-CF-SLM,Eventuri;Eventuri Audi B8 RS5 Black Carbon Facelift Slam Panel Cover;Eventuri,Audi,B8,RS5,Black,Carbon,Facelift,Slam,Panel,Cover,EVE-RS5-CF-SLM,Eventuri;Eventuri-EVE-RS5-CF-SLM;3
1;Eventuri Audi B8 RS5/RS4 Black Carbon Engine Cover;762;78;457.2;EVE-RS5-CF-ENG;Element 1 Engineering - Eventuri;Eventuri;;0;0;0;0;Eventuri,Audi,B8,RS5/RS4,Black,Carbon,Engine,Cover,EVE-RS5-CF-ENG,Eventuri;Eventuri Audi B8 RS5/RS4 Black Carbon Engine Cover;Eventuri,Audi,B8,RS5/RS4,Black,Carbon,Engine,Cover,EVE-RS5-CF-ENG,Eventuri;Eventuri-EVE-RS5-CF-ENG;3
1;Eventuri Audi B9 S5/S4 Black Carbon intake;1380;78;828;EVE-B9S5-CF-INT;Element 1 Engineering - Eventuri;Eventuri;;0;0;0;0;Eventuri,Audi,B9,S5/S4,Black,Carbon,intake,EVE-B9S5-CF-INT,Eventuri;Eventuri Audi B9 S5/S4 Black Carbon intake;Eventuri,Audi,B9,S5/S4,Black,Carbon,intake,EVE-B9S5-CF-INT,Eventuri;Eventuri-EVE-B9S5-CF-INT;3
1;Eventuri Audi B9 RS5/RS4 Black Carbon intake with secondary duct;1571;78;942.6;EVE-B9RS5-CF-INT;Element 1 Engineering - Eventuri;Eventuri;;0;0;0;0;Eventuri,Audi,B9,RS5/RS4,Black,Carbon,intake,with,secondary,duct,EVE-B9RS5-CF-INT,Eventuri;Eventuri Audi B9 RS5/RS4 Black Carbon intake with secondary duct;Eventuri,Audi,B9,RS5/RS4,Black,Carbon,intake,with,secondary,duct,EVE-B9RS5-CF-INT,Eventuri;Eventuri-EVE-B9RS5-CF-INT;3
1;Eventuri Audi C7 S6 S7 Black Carbon intake;2238;78;1342.8;EVE-C7S6-CF-INT;Element 1 Engineering - Eventuri;Eventuri;;0;0;0;0;Eventuri,Audi,C7,S6,S7,Black,Carbon,intake,EVE-C7S6-CF-INT,Eventuri;Eventuri Audi C7 S6 S7 Black Carbon intake;Eventuri,Audi,C7,S6,S7,Black,Carbon,intake,EVE-C7S6-CF-INT,Eventuri;Eventuri-EVE-C7S6-CF-INT;3
1;Eventuri Audi C7 RS6 RS7 Black Carbon intake;2238;78;1342.8;EVE-C7RS6-CF-INT;Element 1 Engineering - Eventuri;Eventuri;;0;0;0;0;Eventuri,Audi,C7,RS6,RS7,Black,Carbon,intake,EVE-C7RS6-CF-INT,Eventuri;Eventuri Audi C7 RS6 RS7 Black Carbon intake;Eventuri,Audi,C7,RS6,RS7,Black,Carbon,intake,EVE-C7RS6-CF-INT,Eventuri;Eventuri-EVE-C7RS6-CF-INT;3
1;Eventuri Audi C8 RS6 RS7 Black Carbon intake Gloss;2650;78;1590;EVE-C8RS6-CF-INT;Element 1 Engineering - Eventuri;Eventuri;;0;0;0;0;Eventuri,Audi,C8,RS6,RS7,Black,Carbon,intake,Gloss,EVE-C8RS6-CF-INT,Eventuri;Eventuri Audi C8 RS6 RS7 Black Carbon intake Gloss;Eventuri,Audi,C8,RS6,RS7,Black,Carbon,intake,Gloss,EVE-C8RS6-CF-INT,Eventuri;Eventuri-EVE-C8RS6-CF-INT;3
1;Eventuri Audi C8 RS6 RS7 Black Carbon intake Matte;2650;78;1590;EVE-C8RS6-CFM-INT;Element 1 Engineering - Eventuri;Eventuri;;0;0;0;0;Eventuri,Audi,C8,RS6,RS7,Black,Carbon,intake,Matte,EVE-C8RS6-CFM-INT,Eventuri;Eventuri Audi C8 RS6 RS7 Black Carbon intake Matte;Eventuri,Audi,C8,RS6,RS7,Black,Carbon,intake,Matte,EVE-C8RS6-CFM-INT,Eventuri;Eventuri-EVE-C8RS6-CFM-INT;3
1;Eventuri Audi C8 RS6 RS7 TTE 888/1020 Hybrid Turbo Inlets ;438;78;262.8;EVE-C8RS6-TTE;Element 1 Engineering - Eventuri;Eventuri;;0;0;0;0;Eventuri,Audi,C8,RS6,RS7,TTE,888/1020,Hybrid,Turbo,Inlets,,EVE-C8RS6-TTE,Eventuri;Eventuri Audi C8 RS6 RS7 TTE 888/1020 Hybrid Turbo Inlets ;Eventuri,Audi,C8,RS6,RS7,TTE,888/1020,Hybrid,Turbo,Inlets,,EVE-C8RS6-TTE,Eventuri;Eventuri-EVE-C8RS6-TTE;3
1;Eventuri Audi C8 RS6 RS7 Black Carbon Engine Cover Gloss;630;78;378;EVE-C8RS6-CF-ENG;Element 1 Engineering - Eventuri;Eventuri;;0;0;0;0;Eventuri,Audi,C8,RS6,RS7,Black,Carbon,Engine,Cover,Gloss,EVE-C8RS6-CF-ENG,Eventuri;Eventuri Audi C8 RS6 RS7 Black Carbon Engine Cover Gloss;Eventuri,Audi,C8,RS6,RS7,Black,Carbon,Engine,Cover,Gloss,EVE-C8RS6-CF-ENG,Eventuri;Eventuri-EVE-C8RS6-CF-ENG;3
1;Eventuri Audi C8 RS6 RS7 Black Carbon Engine Cover Matte;630;78;378;EVE-C8RS6-CFM-ENG;Element 1 Engineering - Eventuri;Eventuri;;0;0;0;0;Eventuri,Audi,C8,RS6,RS7,Black,Carbon,Engine,Cover,Matte,EVE-C8RS6-CFM-ENG,Eventuri;Eventuri Audi C8 RS6 RS7 Black Carbon Engine Cover Matte;Eventuri,Audi,C8,RS6,RS7,Black,Carbon,Engine,Cover,Matte,EVE-C8RS6-CFM-ENG,Eventuri;Eventuri-EVE-C8RS6-CFM-ENG;3
1;Eventuri Audi C8 RS6 2023 Breather Adapter Kit;70;78;42;EVE-C8RS6-PCV;Element 1 Engineering - Eventuri;Eventuri;;0;0;0;0;Eventuri,Audi,C8,RS6,2023,Breather,Adapter,Kit,EVE-C8RS6-PCV,Eventuri;Eventuri Audi C8 RS6 2023 Breather Adapter Kit;Eventuri,Audi,C8,RS6,2023,Breather,Adapter,Kit,EVE-C8RS6-PCV,Eventuri;Eventuri-EVE-C8RS6-PCV;3
1;Eventuri Twin Turbo Intake;2719;78;1631.4;EVE-4V8TT-CF-INT;Element 1 Engineering - Eventuri;Eventuri;;0;0;0;0;Eventuri,Audi,RSQ7,/,RSQ8,2020+,4.0,TFSI,V8,Twin,Turbo,Intake,EVE-4V8TT-CF-INT,Eventuri;Eventuri Audi RSQ7 / RSQ8 2020+ 4.0 TFSI V8 Twin Turbo Intake;Eventuri,Audi,RSQ7,/,RSQ8,2020+,4.0,TFSI,V8,Twin,Turbo,Intake,EVE-4V8TT-CF-INT,Eventuri;Eventuri-EVE-4V8TT-CF-INT;3
1;Eventuri BMW B58 M140i, M240i, M340i Black Carbon intake;1238;78;742.8;EVE-B58-CF-INT;Element 1 Engineering - Eventuri;Eventuri;;0;0;0;0;Eventuri,BMW,B58,M140i,,M240i,,M340i,Black,Carbon,intake,EVE-B58-CF-INT,Eventuri;Eventuri BMW B58 M140i, M240i, M340i Black Carbon intake;Eventuri,BMW,B58,M140i,,M240i,,M340i,Black,Carbon,intake,EVE-B58-CF-INT,Eventuri;Eventuri-EVE-B58-CF-INT;3
1;Eventuri BMW B58 M140i, M240i, M340i  F Series Carbon Engine Cover;619;78;371.4;EVE-B58F-CF-ENG;Element 1 Engineering - Eventuri;Eventuri;;0;0;0;0;Eventuri,BMW,B58,M140i,,M240i,,M340i,,F,Series,Carbon,Engine,Cover,EVE-B58F-CF-ENG,Eventuri;Eventuri BMW B58 M140i, M240i, M340i  F Series Carbon Engine Cover;Eventuri,BMW,B58,M140i,,M240i,,M340i,,F,Series,Carbon,Engine,Cover,EVE-B58F-CF-ENG,Eventuri;Eventuri-EVE-B58F-CF-ENG;3
1;Eventuri BMW E39 M5 Black Carbon intake;1238;78;742.8;EVE-E39-INT;Element 1 Engineering - Eventuri;Eventuri;;0;0;0;0;Eventuri,BMW,E39,M5,Black,Carbon,intake,EVE-E39-INT,Eventuri;Eventuri BMW E39 M5 Black Carbon intake;Eventuri,BMW,E39,M5,Black,Carbon,intake,EVE-E39-INT,Eventuri;Eventuri-EVE-E39-INT;3
1;Eventuri BMW E46 M3 Black Carbon intake;928;78;556.8;EVE-E46-INT;Element 1 Engineering - Eventuri;Eventuri;;0;0;0;0;Eventuri,BMW,E46,M3,Black,Carbon,intake,EVE-E46-INT,Eventuri;Eventuri BMW E46 M3 Black Carbon intake;Eventuri,BMW,E46,M3,Black,Carbon,intake,EVE-E46-INT,Eventuri;Eventuri-EVE-E46-INT;3
1;Eventuri BMW E46 M3 Carbon Scoop ;176;78;105.6;EVE-E46-SC;Element 1 Engineering - Eventuri;Eventuri;;0;0;0;0;Eventuri,BMW,E46,M3,Carbon,Scoop,,EVE-E46-SC,Eventuri;Eventuri BMW E46 M3 Carbon Scoop ;Eventuri,BMW,E46,M3,Carbon,Scoop,,EVE-E46-SC,Eventuri;Eventuri-EVE-E46-SC;3
1;Eventuri BMW E6X M5/M6 Version 2 Black Carbon intake;1450;78;870;EVE-E60V2-CF-INT;Element 1 Engineering - Eventuri;Eventuri;;0;0;0;0;Eventuri,BMW,E6X,M5/M6,Version,2,Black,Carbon,intake,EVE-E60V2-CF-INT,Eventuri;Eventuri BMW E6X M5/M6 Version 2 Black Carbon intake;Eventuri,BMW,E6X,M5/M6,Version,2,Black,Carbon,intake,EVE-E60V2-CF-INT,Eventuri;Eventuri-EVE-E60V2-CF-INT;3
1;Eventuri BMW E6X M5/M6 Carbon Plenum Gloss;2715;78;1629;EVE-S85-CF-PLM;Element 1 Engineering - Eventuri;Eventuri;;0;0;0;0;Eventuri,BMW,E6X,M5/M6,Carbon,Plenum,Gloss,EVE-S85-CF-PLM,Eventuri;Eventuri BMW E6X M5/M6 Carbon Plenum Gloss;Eventuri,BMW,E6X,M5/M6,Carbon,Plenum,Gloss,EVE-S85-CF-PLM,Eventuri;Eventuri-EVE-S85-CF-PLM;3
1;Eventuri BMW E9X M3 Black Carbon intake Gloss;828;78;496.8;EVE-E9X-CF-INT;Element 1 Engineering - Eventuri;Eventuri;;0;0;0;0;Eventuri,BMW,E9X,M3,Black,Carbon,intake,Gloss,EVE-E9X-CF-INT,Eventuri;Eventuri BMW E9X M3 Black Carbon intake Gloss;Eventuri,BMW,E9X,M3,Black,Carbon,intake,Gloss,EVE-E9X-CF-INT,Eventuri;Eventuri-EVE-E9X-CF-INT;3
1;Eventuri BMW E9X M3 Black Carbon intake Matte;828;78;496.8;EVE-E9X-CFM-INT;Element 1 Engineering - Eventuri;Eventuri;;0;0;0;0;Eventuri,BMW,E9X,M3,Black,Carbon,intake,Matte,EVE-E9X-CFM-INT,Eventuri;Eventuri BMW E9X M3 Black Carbon intake Matte;Eventuri,BMW,E9X,M3,Black,Carbon,intake,Matte,EVE-E9X-CFM-INT,Eventuri;Eventuri-EVE-E9X-CFM-INT;3
1;Eventuri BMW E9X M3 Carbon Inlet Plenum Gloss;2238;78;1342.8;EVE-E9X-CF-PLM;Element 1 Engineering - Eventuri;Eventuri;;0;0;0;0;Eventuri,BMW,E9X,M3,Carbon,Inlet,Plenum,Gloss,EVE-E9X-CF-PLM,Eventuri;Eventuri BMW E9X M3 Carbon Inlet Plenum Gloss;Eventuri,BMW,E9X,M3,Carbon,Inlet,Plenum,Gloss,EVE-E9X-CF-PLM,Eventuri;Eventuri-EVE-E9X-CF-PLM;3
1;Eventuri BMW E9X M3 Carbon Inlet Plenum Matte;2238;78;1342.8;EVE-E9X-CFM-PLM;Element 1 Engineering - Eventuri;Eventuri;;0;0;0;0;Eventuri,BMW,E9X,M3,Carbon,Inlet,Plenum,Matte,EVE-E9X-CFM-PLM,Eventuri;Eventuri BMW E9X M3 Carbon Inlet Plenum Matte;Eventuri,BMW,E9X,M3,Carbon,Inlet,Plenum,Matte,EVE-E9X-CFM-PLM,Eventuri;Eventuri-EVE-E9X-CFM-PLM;3
1;Eventuri BMW E9X M3 Carbon Airbox Lid Gloss;571;78;342.6;EVE-E9X-CF-ARB;Element 1 Engineering - Eventuri;Eventuri;;0;0;0;0;Eventuri,BMW,E9X,M3,Carbon,Airbox,Lid,Gloss,EVE-E9X-CF-ARB,Eventuri;Eventuri BMW E9X M3 Carbon Airbox Lid Gloss;Eventuri,BMW,E9X,M3,Carbon,Airbox,Lid,Gloss,EVE-E9X-CF-ARB,Eventuri;Eventuri-EVE-E9X-CF-ARB;3
1;Eventuri BMW E9X M3 Carbon Airbox Lid Matte;571;78;342.6;EVE-E9X-CFM-ARB;Element 1 Engineering - Eventuri;Eventuri;;0;0;0;0;Eventuri,BMW,E9X,M3,Carbon,Airbox,Lid,Matte,EVE-E9X-CFM-ARB,Eventuri;Eventuri BMW E9X M3 Carbon Airbox Lid Matte;Eventuri,BMW,E9X,M3,Carbon,Airbox,Lid,Matte,EVE-E9X-CFM-ARB,Eventuri;Eventuri-EVE-E9X-CFM-ARB;3
1;Eventuri BMW E9X M3 Carbon Duct Set Gloss;670;78;402;EVE-E9X-CF-DCT;Element 1 Engineering - Eventuri;Eventuri;;0;0;0;0;Eventuri,BMW,E9X,M3,Carbon,Duct,Set,Gloss,EVE-E9X-CF-DCT,Eventuri;Eventuri BMW E9X M3 Carbon Duct Set Gloss;Eventuri,BMW,E9X,M3,Carbon,Duct,Set,Gloss,EVE-E9X-CF-DCT,Eventuri;Eventuri-EVE-E9X-CF-DCT;3
1;Eventuri BMW E9X M3 Carbon Duct Set Matte;670;78;402;EVE-E9X-CFM-DCT;Element 1 Engineering - Eventuri;Eventuri;;0;0;0;0;Eventuri,BMW,E9X,M3,Carbon,Duct,Set,Matte,EVE-E9X-CFM-DCT,Eventuri;Eventuri BMW E9X M3 Carbon Duct Set Matte;Eventuri,BMW,E9X,M3,Carbon,Duct,Set,Matte,EVE-E9X-CFM-DCT,Eventuri;Eventuri-EVE-E9X-CFM-DCT;3
1;Eventuri BMW S55 Carbon Chargepipes - Set of 2 Upper Chargepipes;790;78;474;EVE-S55-CF-CHG;Element 1 Engineering - Eventuri;Eventuri;;0;0;0;0;Eventuri,BMW,S55,Carbon,Chargepipes,-,Set,of,2,Upper,Chargepipes,EVE-S55-CF-CHG,Eventuri;Eventuri BMW S55 Carbon Chargepipes - Set of 2 Upper Chargepipes;Eventuri,BMW,S55,Carbon,Chargepipes,-,Set,of,2,Upper,Chargepipes,EVE-S55-CF-CHG,Eventuri;Eventuri-EVE-S55-CF-CHG;3
1;Eventuri BMW S62 V8 Carbon Plenum Lid for E39 M5 and Z8;1190;78;714;EVE-S62-CF-PLM;Element 1 Engineering - Eventuri;Eventuri;;0;0;0;0;Eventuri,BMW,S62,V8,Carbon,Plenum,Lid,for,E39,M5,and,Z8,EVE-S62-CF-PLM,Eventuri;Eventuri BMW S62 V8 Carbon Plenum Lid for E39 M5 and Z8;Eventuri,BMW,S62,V8,Carbon,Plenum,Lid,for,E39,M5,and,Z8,EVE-S62-CF-PLM,Eventuri;Eventuri-EVE-S62-CF-PLM;3
1;Eventuri BMW F8X M3/M4 V2 Full Black Carbon intake with SEALED Carbon ducts;2392;78;1435.2;EVE-F8XMV2-CF-INT;Element 1 Engineering - Eventuri;Eventuri;;0;0;0;0;Eventuri,BMW,F8X,M3/M4,V2,Full,Black,Carbon,intake,with,SEALED,Carbon,ducts,EVE-F8XMV2-CF-INT,Eventuri;Eventuri BMW F8X M3/M4 V2 Full Black Carbon intake with SEALED Carbon ducts;Eventuri,BMW,F8X,M3/M4,V2,Full,Black,Carbon,intake,with,SEALED,Carbon,ducts,EVE-F8XMV2-CF-INT,Eventuri;Eventuri-EVE-F8XMV2-CF-INT;3
1;Eventuri BMW F8X M3/M4 Black Carbon Seat Back Covers;1047;78;628.2;EVE-F8XM-CF-SBC;Element 1 Engineering - Eventuri;Eventuri;;0;0;0;0;Eventuri,BMW,F8X,M3/M4,Black,Carbon,Seat,Back,Covers,EVE-F8XM-CF-SBC,Eventuri;Eventuri BMW F8X M3/M4 Black Carbon Seat Back Covers;Eventuri,BMW,F8X,M3/M4,Black,Carbon,Seat,Back,Covers,EVE-F8XM-CF-SBC,Eventuri;Eventuri-EVE-F8XM-CF-SBC;3
1;Eventuri BMW F8X M3/M4 Black Carbon  Engine Cover;714;78;428.4;EVE-F8XM-CF-ENG;Element 1 Engineering - Eventuri;Eventuri;;0;0;0;0;Eventuri,BMW,F8X,M3/M4,Black,Carbon,,Engine,Cover,EVE-F8XM-CF-ENG,Eventuri;Eventuri BMW F8X M3/M4 Black Carbon  Engine Cover;Eventuri,BMW,F8X,M3/M4,Black,Carbon,,Engine,Cover,EVE-F8XM-CF-ENG,Eventuri;Eventuri-EVE-F8XM-CF-ENG;3
1;Eventuri BMW F9X M5/M8 Black Carbon intake with shrouds;2095;78;1257;EVE-F9XM5M8-CF-INT;Element 1 Engineering - Eventuri;Eventuri;;0;0;0;0;Eventuri,BMW,F9X,M5/M8,Black,Carbon,intake,with,shrouds,EVE-F9XM5M8-CF-INT,Eventuri;Eventuri BMW F9X M5/M8 Black Carbon intake with shrouds;Eventuri,BMW,F9X,M5/M8,Black,Carbon,intake,with,shrouds,EVE-F9XM5M8-CF-INT,Eventuri;Eventuri-EVE-F9XM5M8-CF-INT;3
1;Eventuri BMW F9X M5 Shroud set for upgrading V1 intake;285;78;171;EVE-F90M5-CF-SHR;Element 1 Engineering - Eventuri;Eventuri;;0;0;0;0;Eventuri,BMW,F9X,M5,Shroud,set,for,upgrading,V1,intake,EVE-F90M5-CF-SHR,Eventuri;Eventuri BMW F9X M5 Shroud set for upgrading V1 intake;Eventuri,BMW,F9X,M5,Shroud,set,for,upgrading,V1,intake,EVE-F90M5-CF-SHR,Eventuri;Eventuri-EVE-F90M5-CF-SHR;3
1;Eventuri BMW F9X M5/M8 Turbo Inlets;630;78;378;EVE-F9XM5M8-CHG;Element 1 Engineering - Eventuri;Eventuri;;0;0;0;0;Eventuri,BMW,F9X,M5/M8,Turbo,Inlets,EVE-F9XM5M8-CHG,Eventuri;Eventuri BMW F9X M5/M8 Turbo Inlets;Eventuri,BMW,F9X,M5/M8,Turbo,Inlets,EVE-F9XM5M8-CHG,Eventuri;Eventuri-EVE-F9XM5M8-CHG;3
1;Eventuri BMW F10 M5 Full Black Carbon intake;2110;78;1266;EVE-F10M5-INT;Element 1 Engineering - Eventuri;Eventuri;;0;0;0;0;Eventuri,BMW,F10,M5,Full,Black,Carbon,intake,EVE-F10M5-INT,Eventuri;Eventuri BMW F10 M5 Full Black Carbon intake;Eventuri,BMW,F10,M5,Full,Black,Carbon,intake,EVE-F10M5-INT,Eventuri;Eventuri-EVE-F10M5-INT;3
1;Eventuri BMW F1X M6 Full Black Carbon intake;2250;78;1350;EVE-F1XM6-INT;Element 1 Engineering - Eventuri;Eventuri;;0;0;0;0;Eventuri,BMW,F1X,M6,Full,Black,Carbon,intake,EVE-F1XM6-INT,Eventuri;Eventuri BMW F1X M6 Full Black Carbon intake;Eventuri,BMW,F1X,M6,Full,Black,Carbon,intake,EVE-F1XM6-INT,Eventuri;Eventuri-EVE-F1XM6-INT;3
1;Eventuri BMW F40 M135i, F44 M235i;1238;78;742.8;EVE-F4XB48-CF-INT;Element 1 Engineering - Eventuri;Eventuri;;0;0;0;0;Eventuri,BMW,F40,M135i,,F44,M235i,EVE-F4XB48-CF-INT,Eventuri;Eventuri BMW F40 M135i, F44 M235i;Eventuri,BMW,F40,M135i,,F44,M235i,EVE-F4XB48-CF-INT,Eventuri;Eventuri-EVE-F4XB48-CF-INT;3
1;Eventuri BMW F87 M2 Competition Black Carbon intake;1980;78;1188;EVE-M2C-CF-INT;Element 1 Engineering - Eventuri;Eventuri;;0;0;0;0;Eventuri,BMW,F87,M2,Competition,Black,Carbon,intake,EVE-M2C-CF-INT,Eventuri;Eventuri BMW F87 M2 Competition Black Carbon intake;Eventuri,BMW,F87,M2,Competition,Black,Carbon,intake,EVE-M2C-CF-INT,Eventuri;Eventuri-EVE-M2C-CF-INT;3
1;Eventuri V2 BMW F87 M2, F2X M135i, M235i, F3X 335i, 435i Carbon intake;1314;78;788.4;EVE-N55V2-CF-INT;Element 1 Engineering - Eventuri;Eventuri;;0;0;0;0;Eventuri,V2,BMW,F87,M2,,F2X,M135i,,M235i,,F3X,335i,,435i,Carbon,intake,EVE-N55V2-CF-INT,Eventuri;Eventuri V2 BMW F87 M2, F2X M135i, M235i, F3X 335i, 435i Carbon intake;Eventuri,V2,BMW,F87,M2,,F2X,M135i,,M235i,,F3X,335i,,435i,Carbon,intake,EVE-N55V2-CF-INT,Eventuri;Eventuri-EVE-N55V2-CF-INT;3
1;Eventuri BMW N55 Black Carbon Engine Cover;810;78;486;EVE-N55-ENG;Element 1 Engineering - Eventuri;Eventuri;;0;0;0;0;Eventuri,BMW,N55,Black,Carbon,Engine,Cover,EVE-N55-ENG,Eventuri;Eventuri BMW N55 Black Carbon Engine Cover;Eventuri,BMW,N55,Black,Carbon,Engine,Cover,EVE-N55-ENG,Eventuri;Eventuri-EVE-N55-ENG;3
1;Eventuri BMW F87 M2 Black Carbon Engine Cover;810;78;486;EVE-N55-M2-ENG;Element 1 Engineering - Eventuri;Eventuri;;0;0;0;0;Eventuri,BMW,F87,M2,Black,Carbon,Engine,Cover,EVE-N55-M2-ENG,Eventuri;Eventuri BMW F87 M2 Black Carbon Engine Cover;Eventuri,BMW,F87,M2,Black,Carbon,Engine,Cover,EVE-N55-M2-ENG,Eventuri;Eventuri-EVE-N55-M2-ENG;3
1;Eventuri BMW F9X X3M/X4M Carbon Intake System;1333;78;799.8;EVE-FX34M-CF-INT;Element 1 Engineering - Eventuri;Eventuri;;0;0;0;0;Eventuri,BMW,F9X,X3M/X4M,Carbon,Intake,System,EVE-FX34M-CF-INT,Eventuri;Eventuri BMW F9X X3M/X4M Carbon Intake System;Eventuri,BMW,F9X,X3M/X4M,Carbon,Intake,System,EVE-FX34M-CF-INT,Eventuri;Eventuri-EVE-FX34M-CF-INT;3
1;Eventuri BMW F9X X3M/X4M Carbon Intake System - LCI Version;1333;78;799.8;EVE-FX34M-LCI-INT;Element 1 Engineering - Eventuri;Eventuri;;0;0;0;0;Eventuri,BMW,F9X,X3M/X4M,Carbon,Intake,System,-,LCI,Version,EVE-FX34M-LCI-INT,Eventuri;Eventuri BMW F9X X3M/X4M Carbon Intake System - LCI Version;Eventuri,BMW,F9X,X3M/X4M,Carbon,Intake,System,-,LCI,Version,EVE-FX34M-LCI-INT,Eventuri;Eventuri-EVE-FX34M-LCI-INT;3
1;Eventuri BMW F9X X5M/X6M, G09 XM, X5/X7 M60i Intake System;2475;78;1485;EVE-X56M-CF-INT;Element 1 Engineering - Eventuri;Eventuri;;0;0;0;0;Eventuri,BMW,F9X,X5M/X6M,,G09,XM,,X5/X7,M60i,Intake,System,EVE-X56M-CF-INT,Eventuri;Eventuri BMW F9X X5M/X6M, G09 XM, X5/X7 M60i Intake System;Eventuri,BMW,F9X,X5M/X6M,,G09,XM,,X5/X7,M60i,Intake,System,EVE-X56M-CF-INT,Eventuri;Eventuri-EVE-X56M-CF-INT;3
1;Eventuri BMW Z4M Black Carbon intake;810;78;486;EVE-Z4M-INT;Element 1 Engineering - Eventuri;Eventuri;;0;0;0;0;Eventuri,BMW,Z4M,Black,Carbon,intake,EVE-Z4M-INT,Eventuri;Eventuri BMW Z4M Black Carbon intake;Eventuri,BMW,Z4M,Black,Carbon,intake,EVE-Z4M-INT,Eventuri;Eventuri-EVE-Z4M-INT;3
1;Eventuri BMW G01 X3 M40i, G02 X3 M40i (B58D Engine Version) Carbon Intake ;1333;78;799.8;EVE-GXXB58-CF-INT;Element 1 Engineering - Eventuri;Eventuri;;0;0;0;0;Eventuri,BMW,G01,X3,M40i,,G02,X3,M40i,B58D,Engine,Version,Carbon,Intake,,EVE-GXXB58-CF-INT,Eventuri;Eventuri BMW G01 X3 M40i, G02 X3 M40i (B58D Engine Version) Carbon Intake ;Eventuri,BMW,G01,X3,M40i,,G02,X3,M40i,B58D,Engine,Version,Carbon,Intake,,EVE-GXXB58-CF-INT,Eventuri;Eventuri-EVE-GXXB58-CF-INT;3
1;Eventuri BMW G20 B48/B46 Intake System - Pre 2018 November;1333;78;799.8;EVE-G20B48-V1-INT;Element 1 Engineering - Eventuri;Eventuri;;0;0;0;0;Eventuri,BMW,G20,B48/B46,Intake,System,-,Pre,2018,November,EVE-G20B48-V1-INT,Eventuri;Eventuri BMW G20 B48/B46 Intake System - Pre 2018 November;Eventuri,BMW,G20,B48/B46,Intake,System,-,Pre,2018,November,EVE-G20B48-V1-INT,Eventuri;Eventuri-EVE-G20B48-V1-INT;3
1;Eventuri BMW G20/G42 B48/B46 Intake System - Post 2018 November;1333;78;799.8;EVE-G20B48-V2-INT;Element 1 Engineering - Eventuri;Eventuri;;0;0;0;0;Eventuri,BMW,G20/G42,B48/B46,Intake,System,-,Post,2018,November,EVE-G20B48-V2-INT,Eventuri;Eventuri BMW G20/G42 B48/B46 Intake System - Post 2018 November;Eventuri,BMW,G20/G42,B48/B46,Intake,System,-,Post,2018,November,EVE-G20B48-V2-INT,Eventuri;Eventuri-EVE-G20B48-V2-INT;3
1;Eventuri BMW G20 B58 Intake System - Pre 2018 November;1333;78;799.8;EVE-G20B58-V1-INT;Element 1 Engineering - Eventuri;Eventuri;;0;0;0;0;Eventuri,BMW,G20,B58,Intake,System,-,Pre,2018,November,EVE-G20B58-V1-INT,Eventuri;Eventuri BMW G20 B58 Intake System - Pre 2018 November;Eventuri,BMW,G20,B58,Intake,System,-,Pre,2018,November,EVE-G20B58-V1-INT,Eventuri;Eventuri-EVE-G20B58-V1-INT;3
