Active;Name *;Price tax excluded;Tax rules ID;Wholesale price;Reference #;Supplier;Manufacturer;EAN13;Width;Height;Depth;Weight;Tags (xyz...);Meta title;Meta keywords;URL rewritten;ID store
1;Eventuri Golf MK8 Engine Cover;570;78;342;EVE-EA8884-CF-ENG;Element 1 Engineering - Eventuri;Eventuri;;0;0;0;0;Eventuri,Golf,MK8,Engine,Cover,EVE-EA8884-CF-ENG,Eventuri;Eventuri Golf MK8 Engine Cover;Eventuri,Golf,MK8,Engine,Cover,EVE-EA8884-CF-ENG,Eventuri;Eventuri-EVE-EA8884-CF-ENG;3
1;Eventuri Filter Cleaning Kit;28;78;16.8;EVE-FLC;Element 1 Engineering - Eventuri;Eventuri;;0;0;0;0;Eventuri,Filter,Cleaning,Kit,EVE-FLC,Eventuri;Eventuri Filter Cleaning Kit;Eventuri,Filter,Cleaning,Kit,EVE-FLC,Eventuri;Eventuri-EVE-FLC;3
1;Eventuri Replacement Filter TYPE S;85;78;51;EVE-151-G2-FTR;Element 1 Engineering - Eventuri;Eventuri;;0;0;0;0;Eventuri,Replacement,Filter,TYPE,S,EVE-151-G2-FTR,Eventuri;Eventuri Replacement Filter TYPE S;Eventuri,Replacement,Filter,TYPE,S,EVE-151-G2-FTR,Eventuri;Eventuri-EVE-151-G2-FTR;3
1;Eventuri Replacement Filter TYPE B;85;78;51;EVE-661-G2-FTR;Element 1 Engineering - Eventuri;Eventuri;;0;0;0;0;Eventuri,Replacement,Filter,TYPE,B,EVE-661-G2-FTR,Eventuri;Eventuri Replacement Filter TYPE B;Eventuri,Replacement,Filter,TYPE,B,EVE-661-G2-FTR,Eventuri;Eventuri-EVE-661-G2-FTR;3
1;Eventuri Replacement Filter TYPE E;85;78;51;EVE-991-FTR ;Element 1 Engineering - Eventuri;Eventuri;;0;0;0;0;Eventuri,Replacement,Filter,TYPE,E,EVE-991-FTR,,Eventuri;Eventuri Replacement Filter TYPE E;Eventuri,Replacement,Filter,TYPE,E,EVE-991-FTR,,Eventuri;Eventuri-EVE-991-FTR ;3
1;Eventuri Replacement Filter TYPE D;95;78;57;EVE-W210-FTR ;Element 1 Engineering - Eventuri;Eventuri;;0;0;0;0;Eventuri,Replacement,Filter,TYPE,D,EVE-W210-FTR,,Eventuri;Eventuri Replacement Filter TYPE D;Eventuri,Replacement,Filter,TYPE,D,EVE-W210-FTR,,Eventuri;Eventuri-EVE-W210-FTR ;3
1;Eventuri Replacement Filter TYPE L;85;78;51;EVE-15144-G2-FTR;Element 1 Engineering - Eventuri;Eventuri;;0;0;0;0;Eventuri,Replacement,Filter,TYPE,L,EVE-15144-G2-FTR,Eventuri;Eventuri Replacement Filter TYPE L;Eventuri,Replacement,Filter,TYPE,L,EVE-15144-G2-FTR,Eventuri;Eventuri-EVE-15144-G2-FTR;3
1;Eventuri Replacement Filter TYPE D2;95;78;57;EVE-W192-FTR ;Element 1 Engineering - Eventuri;Eventuri;;0;0;0;0;Eventuri,Replacement,Filter,TYPE,D2,EVE-W192-FTR,,Eventuri;Eventuri Replacement Filter TYPE D2;Eventuri,Replacement,Filter,TYPE,D2,EVE-W192-FTR,,Eventuri;Eventuri-EVE-W192-FTR ;3
1;Eventuri Replacement Filter TYPE L2;85;78;51;EVE-1046-FTR;Element 1 Engineering - Eventuri;Eventuri;;0;0;0;0;Eventuri,Replacement,Filter,TYPE,L2,EVE-1046-FTR,Eventuri;Eventuri Replacement Filter TYPE L2;Eventuri,Replacement,Filter,TYPE,L2,EVE-1046-FTR,Eventuri;Eventuri-EVE-1046-FTR;3
1;Eventuri BMW E46 M3 Panel Filter Pair;59;78;35.4;EVE-E46-PF;Element 1 Engineering - Eventuri;Eventuri;;0;0;0;0;Eventuri,BMW,E46,M3,Panel,Filter,Pair,EVE-E46-PF,Eventuri;Eventuri BMW E46 M3 Panel Filter Pair;Eventuri,BMW,E46,M3,Panel,Filter,Pair,EVE-E46-PF,Eventuri;Eventuri-EVE-E46-PF;3
1;Eventuri BMW F8X M3/M4 Panel Filter Pair;114;78;68.4;EVE-F8XM-PF;Element 1 Engineering - Eventuri;Eventuri;;0;0;0;0;Eventuri,BMW,F8X,M3/M4,Panel,Filter,Pair,EVE-F8XM-PF,Eventuri;Eventuri BMW F8X M3/M4 Panel Filter Pair;Eventuri,BMW,F8X,M3/M4,Panel,Filter,Pair,EVE-F8XM-PF,Eventuri;Eventuri-EVE-F8XM-PF;3
1;Eventuri BMW F1X M5/M6 Panel Filter Pair;114;78;68.4;EVE-F10M5-PF;Element 1 Engineering - Eventuri;Eventuri;;0;0;0;0;Eventuri,BMW,F1X,M5/M6,Panel,Filter,Pair,EVE-F10M5-PF,Eventuri;Eventuri BMW F1X M5/M6 Panel Filter Pair;Eventuri,BMW,F1X,M5/M6,Panel,Filter,Pair,EVE-F10M5-PF,Eventuri;Eventuri-EVE-F10M5-PF;3
1;Eventuri BMW N55 Panel Filter ;81;78;48.6;EVE-N55-PF;Element 1 Engineering - Eventuri;Eventuri;;0;0;0;0;Eventuri,BMW,N55,Panel,Filter,,EVE-N55-PF,Eventuri;Eventuri BMW N55 Panel Filter ;Eventuri,BMW,N55,Panel,Filter,,EVE-N55-PF,Eventuri;Eventuri-EVE-N55-PF;3
1;Eventuri BMW F9X X3M/X4M Panel Filter Replacement Set;190;78;114;EVE-FX34M-PF;Element 1 Engineering - Eventuri;Eventuri;;0;0;0;0;Eventuri,BMW,F9X,X3M/X4M,Panel,Filter,Replacement,Set,EVE-FX34M-PF,Eventuri;Eventuri BMW F9X X3M/X4M Panel Filter Replacement Set;Eventuri,BMW,F9X,X3M/X4M,Panel,Filter,Replacement,Set,EVE-FX34M-PF,Eventuri;Eventuri-EVE-FX34M-PF;3
1;Eventuri Panel Filter for Eventuri GLC63S / C63S Intake set of 2;114;78;68.4;EVE-C63-FTR;Element 1 Engineering - Eventuri;Eventuri;;0;0;0;0;Eventuri,Panel,Filter,for,Eventuri,GLC63S,/,C63S,Intake,set,of,2,EVE-C63-FTR,Eventuri;Eventuri Panel Filter for Eventuri GLC63S / C63S Intake set of 2;Eventuri,Panel,Filter,for,Eventuri,GLC63S,/,C63S,Intake,set,of,2,EVE-C63-FTR,Eventuri;Eventuri-EVE-C63-FTR;3
1;Eventuri Custom BMC Panel Filter For C8 RS6 Intake;252;78;151.2;EVE-C8BMC-FTR;Element 1 Engineering - Eventuri;Eventuri;;0;0;0;0;Eventuri,Custom,BMC,Panel,Filter,For,C8,RS6,Intake,EVE-C8BMC-FTR,Eventuri;Eventuri Custom BMC Panel Filter For C8 RS6 Intake;Eventuri,Custom,BMC,Panel,Filter,For,C8,RS6,Intake,EVE-C8BMC-FTR,Eventuri;Eventuri-EVE-C8BMC-FTR;3
1;Eventuri V Badge;14;78;8.4;EVE-Vbadge;Element 1 Engineering - Eventuri;Eventuri;;0;0;0;0;Eventuri,V,Badge,EVE-Vbadge,Eventuri;Eventuri V Badge;Eventuri,V,Badge,EVE-Vbadge,Eventuri;Eventuri-EVE-Vbadge;3
1;Eventuri Mini Cooper S/JCW MAF tube;71;78;42.6;EVE-F56-MAF;Element 1 Engineering - Eventuri;Eventuri;;0;0;0;0;Eventuri,Mini,Cooper,S/JCW,MAF,tube,EVE-F56-MAF,Eventuri;Eventuri Mini Cooper S/JCW MAF tube;Eventuri,Mini,Cooper,S/JCW,MAF,tube,EVE-F56-MAF,Eventuri;Eventuri-EVE-F56-MAF;3
1;Eventuri Mini Cooper S/JCW Facelift MAF tube;71;78;42.6;EVE-F56-LCI-MAF;Element 1 Engineering - Eventuri;Eventuri;;0;0;0;0;Eventuri,Mini,Cooper,S/JCW,Facelift,MAF,tube,EVE-F56-LCI-MAF,Eventuri;Eventuri Mini Cooper S/JCW Facelift MAF tube;Eventuri,Mini,Cooper,S/JCW,Facelift,MAF,tube,EVE-F56-LCI-MAF,Eventuri;Eventuri-EVE-F56-LCI-MAF;3
1;Eventuri Honda FK8 Silicon between Intake and Upgraded Chargepipe;71;78;42.6;EVE-FK8-CHG-SLC;Element 1 Engineering - Eventuri;Eventuri;;0;0;0;0;Eventuri,Honda,FK8,Silicon,between,Intake,and,Upgraded,Chargepipe,EVE-FK8-CHG-SLC,Eventuri;Eventuri Honda FK8 Silicon between Intake and Upgraded Chargepipe;Eventuri,Honda,FK8,Silicon,between,Intake,and,Upgraded,Chargepipe,EVE-FK8-CHG-SLC,Eventuri;Eventuri-EVE-FK8-CHG-SLC;3
